{"actor_user_id":"e2e_bob@test.local","conversation_id":"c_b5231c13e156479d9049828e7bc4ceeb","effective_user_id":"e2e_bob@test.local","event_id":"msg_send_c_b5231c13e156479d9049828e7bc4ceeb_m_7a05db433d094498b57c1cd4557d9ae2_1773009016_e2e_bob@test.local","event_ts":1773009016,"event_type":"message.sent","message_id":"m_7a05db433d094498b57c1cd4557d9ae2","payload":{"message":{"conversation_id":"c_b5231c13e156479d9049828e7bc4ceeb","created_at":1773009016,"expired":false,"expires_at":1773009028,"is_encrypted":false,"is_unlocked":true,"kind":"text","locked":false,"message_id":"m_7a05db433d094498b57c1cd4557d9ae2","scheduled":false,"sender_id":"e2e_bob@test.local","text":"exp-sidebar-1773008918038","view_once":false},"mutation":"send","scheduled":false},"payload_hash":"8fcd415375ea2645a31a65b8609e88639295f0adf6c69ea1ad038763d81a4048","prev_hash":"0000000000000000000000000000000000000000000000000000000000000000","schema_version":1,"tenant_id":"default"}