{"actor_user_id":"e2e_charlie@test.local","conversation_id":"c_66336b94d18341c682dd8a60193152cd","effective_user_id":"e2e_charlie@test.local","event_id":"membership_conversation.member_joined_c_66336b94d18341c682dd8a60193152cd_e2e_charlie@test.local_1772999761_e2e_charlie@test.loca","event_ts":1772999761,"event_type":"conversation.member_joined","message_id":"membership_e2e_charlie@test.local","payload":{"role":"admin","status":"active","subject_user_id":"e2e_charlie@test.local","timeline_state":{"conversation_created_at":1772999761,"participant_count":3},"transition":"conversation_created"},"payload_hash":"6f4c5386cc630216178e35353ddbfe40e7a662ec1d9256336e76a6b1f48c8378","prev_hash":"0000000000000000000000000000000000000000000000000000000000000000","schema_version":1,"tenant_id":"default"}