{"actor_user_id":"e2e_alice@test.local","conversation_id":"c_254127508d3c4d2b8053cb70f6b524ef","effective_user_id":"e2e_alice@test.local","event_id":"membership_conversation.member_joined_c_254127508d3c4d2b8053cb70f6b524ef_e2e_bob@test.local_1773005757_e2e_alice@test.local","event_ts":1773005757,"event_type":"conversation.member_joined","message_id":"membership_e2e_bob@test.local","payload":{"role":"member","status":"active","subject_user_id":"e2e_bob@test.local","timeline_state":{"conversation_created_at":1773005757,"participant_count":2},"transition":"conversation_created"},"payload_hash":"867c65a17d99e327a050124220378cab404664941f72d5ee0b874cccf3357649","prev_hash":"0000000000000000000000000000000000000000000000000000000000000000","schema_version":1,"tenant_id":"default"}