{"actor_user_id":"e2e_alice@test.local","conversation_id":"c_3897c013d9e844c8974f4c75297c5228","effective_user_id":"e2e_alice@test.local","event_id":"msg_send_c_3897c013d9e844c8974f4c75297c5228_m_9ca6f0a73d134f318f9c97111e5e4d4f_1773009565_e2e_alice@test.local","event_ts":1773009565,"event_type":"message.sent","message_id":"m_9ca6f0a73d134f318f9c97111e5e4d4f","payload":{"message":{"conversation_id":"c_3897c013d9e844c8974f4c75297c5228","created_at":1773009565,"encryption":{"alg":"AES-256-GCM","ciphertext_b64":"AAAAAAAAAAAAAAAAAAAAAAAAAAAAAAAAAAAAAAAAAAA=","iterations":600000,"iv_b64":"AAAAAAAAAAAAAAAA","kdf":"PBKDF2-SHA256","salt_b64":"AAAAAAAAAAAAAAAAAAAAAA==","version":1},"expired":false,"is_encrypted":true,"is_unlocked":true,"kind":"text","locked":false,"message_id":"m_9ca6f0a73d134f318f9c97111e5e4d4f","scheduled":false,"sender_id":"e2e_alice@test.local","view_once":false},"mutation":"send","scheduled":false},"payload_hash":"45cedd449d4f5affe27917529f8e1537152cd401600ffc234ac96b7ad1737517","prev_hash":"0000000000000000000000000000000000000000000000000000000000000000","schema_version":1,"tenant_id":"default"}