{"actor_user_id":"e2e_alice@test.local","conversation_id":"c_3279bb68a03d4b2186153b96f3c70a60","effective_user_id":"e2e_alice@test.local","event_id":"msg_send_c_3279bb68a03d4b2186153b96f3c70a60_m_09223445f0f542faa67aaf7e884c6f29_1773007748_e2e_alice@test.local","event_ts":1773007748,"event_type":"message.sent","message_id":"m_09223445f0f542faa67aaf7e884c6f29","payload":{"message":{"conversation_id":"c_3279bb68a03d4b2186153b96f3c70a60","created_at":1773007748,"expired":false,"is_encrypted":false,"is_unlocked":true,"kind":"text","locked":false,"message_id":"m_09223445f0f542faa67aaf7e884c6f29","scheduled":false,"sender_id":"e2e_alice@test.local","text":"touch1773007748768","view_once":false},"mutation":"send","scheduled":false},"payload_hash":"e7de55b72a8dccffe3270afdfd40ec9be42dc72f232d617c8d6b55b25bb996e8","prev_hash":"0000000000000000000000000000000000000000000000000000000000000000","schema_version":1,"tenant_id":"default"}