{"actor_user_id":"e2e_alice@test.local","conversation_id":"c_ff5730d977434633a9a0ae776fbbee6f","effective_user_id":"e2e_alice@test.local","event_id":"membership_conversation.member_joined_c_ff5730d977434633a9a0ae776fbbee6f_e2e_bob@test.local_1772999729_e2e_alice@test.local","event_ts":1772999729,"event_type":"conversation.member_joined","message_id":"membership_e2e_bob@test.local","payload":{"role":"member","status":"active","subject_user_id":"e2e_bob@test.local","timeline_state":{"conversation_created_at":1772999729,"participant_count":2},"transition":"conversation_created"},"payload_hash":"5114b3b4b2f76da3648f19af4c90e21a10b051817697d4e7e831c1ea05d26cf1","prev_hash":"0000000000000000000000000000000000000000000000000000000000000000","schema_version":1,"tenant_id":"default"}