{"actor_user_id":"e2e_charlie@test.local","conversation_id":"c_827d9930ca8b40189052f983d8f81336","effective_user_id":"e2e_charlie@test.local","event_id":"membership_conversation.member_joined_c_827d9930ca8b40189052f983d8f81336_e2e_alice@test.local_1773005887_e2e_charlie@test.local","event_ts":1773005887,"event_type":"conversation.member_joined","message_id":"membership_e2e_alice@test.local","payload":{"role":"member","status":"pending","subject_user_id":"e2e_alice@test.local","timeline_state":{"conversation_created_at":1773005887,"participant_count":3},"transition":"conversation_created"},"payload_hash":"1afa8796af652a46964edf4707e3d27221b2ea27e8b3e705139b576bac82a421","prev_hash":"0000000000000000000000000000000000000000000000000000000000000000","schema_version":1,"tenant_id":"default"}