{"actor_user_id":"e2e_bob@test.local","conversation_id":"c_c332d9145a6a412fb75f902fdf654215","effective_user_id":"e2e_bob@test.local","event_id":"msg_send_c_c332d9145a6a412fb75f902fdf654215_m_551c4bc6bd82499d857fdb3f441a15d5_1773006999_e2e_bob@test.local","event_ts":1773006999,"event_type":"message.sent","message_id":"m_551c4bc6bd82499d857fdb3f441a15d5","payload":{"message":{"conversation_id":"c_c332d9145a6a412fb75f902fdf654215","created_at":1773006999,"expired":false,"is_encrypted":false,"is_unlocked":true,"kind":"text","locked":false,"message_id":"m_551c4bc6bd82499d857fdb3f441a15d5","scheduled":false,"sender_id":"e2e_bob@test.local","text":"Compliance test DM message 1773006998875","view_once":false},"mutation":"send","scheduled":false},"payload_hash":"bb13ff4dbbf9cd950233f5cbf9ada476cd133847d89395939939564e47a82f86","prev_hash":"0000000000000000000000000000000000000000000000000000000000000000","schema_version":1,"tenant_id":"default"}