{"actor_user_id":"e2e_alice@test.local","conversation_id":"c_844fea97e2d544fda5ffd9050ea47a36","effective_user_id":"e2e_alice@test.local","event_id":"msg_send_c_844fea97e2d544fda5ffd9050ea47a36_m_14e0a60055124e5cbed056b48f3dde41_1773008136_e2e_alice@test.local","event_ts":1773008136,"event_type":"message.sent","message_id":"m_14e0a60055124e5cbed056b48f3dde41","payload":{"message":{"conversation_id":"c_844fea97e2d544fda5ffd9050ea47a36","created_at":1773008136,"expired":false,"is_encrypted":false,"is_unlocked":true,"kind":"text","locked":false,"message_id":"m_14e0a60055124e5cbed056b48f3dde41","scheduled":false,"sender_id":"e2e_alice@test.local","text":"__touch__1773008136409","view_once":false},"mutation":"send","scheduled":false},"payload_hash":"75eb10852823328f528c854a5a46d5cb104a5fd4adf0a22bd7b78f791ff78873","prev_hash":"0000000000000000000000000000000000000000000000000000000000000000","schema_version":1,"tenant_id":"default"}