{"actor_user_id":"e2e_alice@test.local","conversation_id":"c_5a7c83090d114f39aaef8582245c1049","effective_user_id":"e2e_alice@test.local","event_id":"membership_conversation.member_joined_c_5a7c83090d114f39aaef8582245c1049_e2e_bob@test.local_1773007654_e2e_alice@test.local","event_ts":1773007654,"event_type":"conversation.member_joined","message_id":"membership_e2e_bob@test.local","payload":{"role":"member","status":"active","subject_user_id":"e2e_bob@test.local","timeline_state":{"conversation_created_at":1773007654,"participant_count":2},"transition":"conversation_created"},"payload_hash":"b072c61c8dd700437b4e3d880b7c5bebb76750ae19f1222168ac40a41ef97cc0","prev_hash":"0000000000000000000000000000000000000000000000000000000000000000","schema_version":1,"tenant_id":"default"}