{"actor_user_id":"e2e_alice@test.local","conversation_id":"c_2d12060acc99445483095f379e5ca334","effective_user_id":"e2e_alice@test.local","event_id":"msg_send_c_2d12060acc99445483095f379e5ca334_m_2030921095de4078bf47c0a8bd37c5c9_1773009531_e2e_alice@test.local","event_ts":1773009531,"event_type":"message.sent","message_id":"m_2030921095de4078bf47c0a8bd37c5c9","payload":{"message":{"conversation_id":"c_2d12060acc99445483095f379e5ca334","created_at":1773009531,"expired":false,"is_encrypted":false,"is_unlocked":true,"kind":"text","locked":false,"message_id":"m_2030921095de4078bf47c0a8bd37c5c9","scheduled":false,"sender_id":"e2e_alice@test.local","text":"__touch__1773009531243","view_once":false},"mutation":"send","scheduled":false},"payload_hash":"65b992ee155f2affbcd85d92bf069cd3441ccde850a195e87b0b8cc2f2465c75","prev_hash":"0000000000000000000000000000000000000000000000000000000000000000","schema_version":1,"tenant_id":"default"}