{"actor_user_id":"e2e_alice@test.local","conversation_id":"c_c74b23e47aa4400c854598bf957fa610","effective_user_id":"e2e_alice@test.local","event_id":"msg_send_c_c74b23e47aa4400c854598bf957fa610_m_331ee0ce6b9b41d8ad636e0e697d6493_1773007502_e2e_alice@test.local","event_ts":1773007502,"event_type":"message.sent","message_id":"m_331ee0ce6b9b41d8ad636e0e697d6493","payload":{"message":{"conversation_id":"c_c74b23e47aa4400c854598bf957fa610","created_at":1773007502,"expired":false,"free_images":[{"bucket":"local-chat-images","content_type":"video/mp4","key":"c_c74b23e47aa4400c854598bf957fa610/e2e_alice@test.local/1773007502_ed3e103b415e4018b482f640feb55a4c_tip_vid.mp4","url":"/mock/s3/local-chat-images/c_c74b23e47aa4400c854598bf957fa610/e2e_alice%40test.local/1773007502_ed3e103b415e4018b482f640feb55a4c_tip_vid.mp4"}],"is_encrypted":false,"is_unlocked":true,"kind":"gallery","locked":false,"locked_image_count":0,"locked_images":[],"message_id":"m_331ee0ce6b9b41d8ad636e0e697d6493","scheduled":false,"sender_id":"e2e_alice@test.local","tip_amount_cents":75,"tip_currency":"USD","tip_payment_id":"tip_a37f0978b5164348bd29839de02b7a70","view_once":false},"mutation":"send","scheduled":false},"payload_hash":"04e346aaca7b17e4080e387ef3a58a29cfb40d30e5aa625ec2febc998e4ebe42","prev_hash":"0000000000000000000000000000000000000000000000000000000000000000","schema_version":1,"tenant_id":"default"}