{"actor_user_id":"e2e_alice@test.local","conversation_id":"c_e3b513ca2f184113b1526fba291870ca","effective_user_id":"e2e_alice@test.local","event_id":"msg_send_c_e3b513ca2f184113b1526fba291870ca_m_e2a3012d3fba4b03a825efb153d82b34_1773007739_e2e_alice@test.local","event_ts":1773007739,"event_type":"message.sent","message_id":"m_e2a3012d3fba4b03a825efb153d82b34","payload":{"message":{"calendar_event":{"all_day":false,"all_day_date":null,"calendar_id":"20a0f7bb9ab54a1292df667a862c6726","description":"","end_utc":"2026-06-15T15:00:00Z","event_id":"0957478d9f374dff9a5ce55e426cc6da","name":"E2E Event 1773007739644","owner":"e2e_alice@test.local","start_utc":"2026-06-15T14:00:00Z","timezone":"UTC"},"conversation_id":"c_e3b513ca2f184113b1526fba291870ca","created_at":1773007739,"expired":false,"is_encrypted":false,"is_unlocked":true,"kind":"calendar_event","locked":false,"message_id":"m_e2a3012d3fba4b03a825efb153d82b34","scheduled":false,"sender_id":"e2e_alice@test.local","text":"Check out this event 1773007739931","view_once":false},"mutation":"send","scheduled":false},"payload_hash":"b1ac198608fb59a1c7246656528d7ead3dc040f1892a9d6dbe236330fac5d136","prev_hash":"0000000000000000000000000000000000000000000000000000000000000000","schema_version":1,"tenant_id":"default"}