{"actor_user_id":"e2e_charlie@test.local","conversation_id":"c_16f8fe1f2114457e9ac1b372560aa9eb","effective_user_id":"e2e_charlie@test.local","event_id":"msg_send_c_16f8fe1f2114457e9ac1b372560aa9eb_m_5f530b6464ca49b684ef7012c758bc2d_1772999827_e2e_charlie@test.local","event_ts":1772999827,"event_type":"message.sent","message_id":"m_5f530b6464ca49b684ef7012c758bc2d","payload":{"message":{"conversation_id":"c_16f8fe1f2114457e9ac1b372560aa9eb","created_at":1772999827,"expired":false,"is_encrypted":false,"is_unlocked":true,"kind":"text","locked":false,"message_id":"m_5f530b6464ca49b684ef7012c758bc2d","scheduled":false,"sender_id":"e2e_charlie@test.local","text":"Compliance test group message 1772999825503","view_once":false},"mutation":"send","scheduled":false},"payload_hash":"8055f8d445efce1b7788c4ad3152fab23ffd47412c6cabbb7e2bb96eff3c16ff","prev_hash":"0000000000000000000000000000000000000000000000000000000000000000","schema_version":1,"tenant_id":"default"}