{"actor_user_id":"e2e_alice@test.local","conversation_id":"c_bd4b37d2c31c4f2e96fdd8cac622b2de","effective_user_id":"e2e_alice@test.local","event_id":"membership_conversation.member_joined_c_bd4b37d2c31c4f2e96fdd8cac622b2de_e2e_bob@test.local_1772999763_e2e_alice@test.local","event_ts":1772999763,"event_type":"conversation.member_joined","message_id":"membership_e2e_bob@test.local","payload":{"role":"member","status":"active","subject_user_id":"e2e_bob@test.local","timeline_state":{"conversation_created_at":1772999763,"participant_count":2},"transition":"conversation_created"},"payload_hash":"13a2e3d26b1aec41739d40fe8ed8f05f7d0c83e200302a18cf631ba995c71557","prev_hash":"0000000000000000000000000000000000000000000000000000000000000000","schema_version":1,"tenant_id":"default"}