{"actor_user_id":"e2e_alice@test.local","conversation_id":"c_844fea97e2d544fda5ffd9050ea47a36","effective_user_id":"e2e_alice@test.local","event_id":"msg_scheduled_delivery_c_844fea97e2d544fda5ffd9050ea47a36_m_2a979a12902e482b9a47d0a40ad12d73_1773011802_e2e_alice@test.local","event_ts":1773011802,"event_type":"message.edited","message_id":"m_2a979a12902e482b9a47d0a40ad12d73","payload":{"from_status":"scheduled","message":{"conversation_id":"c_844fea97e2d544fda5ffd9050ea47a36","created_at":1773011802,"expired":false,"free_images":[],"is_encrypted":false,"is_unlocked":true,"kind":"gallery","lock_price_cents":199,"locked":true,"locked_image_count":1,"locked_images":[{"bucket":"local-chat-images","content_type":"image/jpeg","key":"c_844fea97e2d544fda5ffd9050ea47a36/e2e_alice@test.local/1773008187_bc31965615204516bd6cdf2eda295349_gsched_img.jpg","preview_bucket":"local-chat-images","preview_key":"c_844fea97e2d544fda5ffd9050ea47a36/e2e_alice@test.local/1773008187_e3f24249d01041a0b1e26f97667942ae_gsched_preview.jpg","preview_url":"/mock/s3/local-chat-images/c_844fea97e2d544fda5ffd9050ea47a36/e2e_alice%40test.local/1773008187_e3f24249d01041a0b1e26f97667942ae_gsched_preview.jpg","url":"/mock/s3/local-chat-images/c_844fea97e2d544fda5ffd9050ea47a36/e2e_alice%40test.local/1773008187_bc31965615204516bd6cdf2eda295349_gsched_img.jpg"}],"message_id":"m_2a979a12902e482b9a47d0a40ad12d73","scheduled":false,"sender_id":"e2e_alice@test.local","view_once":false},"mutation":"scheduled_delivery_transition","to_status":"sent"},"payload_hash":"ca2bb9183a22a49f9127187acceb0f8a756378ffb86a8ca865bea5947ecec7a1","prev_hash":"0000000000000000000000000000000000000000000000000000000000000000","schema_version":1,"tenant_id":"default"}