{"actor_user_id":"e2e_alice@test.local","conversation_id":"c_c74b23e47aa4400c854598bf957fa610","effective_user_id":"e2e_alice@test.local","event_id":"msg_send_c_c74b23e47aa4400c854598bf957fa610_m_15f6025fbcd44e32b4adf869e5b96d9a_1773007496_e2e_alice@test.local","event_ts":1773007496,"event_type":"message.sent","message_id":"m_15f6025fbcd44e32b4adf869e5b96d9a","payload":{"message":{"conversation_id":"c_c74b23e47aa4400c854598bf957fa610","created_at":1773007496,"deliver_at":1773007615,"encryption":{"alg":"AES-256-GCM","ciphertext_b64":"AAAAAAAAAAAAAAAAAAAAAAAAAAAAAAAAAAAAAAAAAAA=","iterations":100000,"iv_b64":"AAAAAAAAAAAAAAAA","kdf":"PBKDF2-SHA256","salt_b64":"AAAAAAAAAAAAAAAAAAAAAA==","version":1},"expired":false,"is_encrypted":true,"is_unlocked":true,"kind":"text","lock_price_cents":199,"locked":true,"message_id":"m_15f6025fbcd44e32b4adf869e5b96d9a","scheduled":true,"sender_id":"e2e_alice@test.local","view_once":false},"mutation":"send","scheduled":true},"payload_hash":"f5957c8bd909a89de3941e3bb28e2602ef0fb7f81a20596992c6f0fbf57b61f2","prev_hash":"0000000000000000000000000000000000000000000000000000000000000000","schema_version":1,"tenant_id":"default"}