{"actor_user_id":"e2e_alice@test.local","conversation_id":"c_1f938251b203440fa463a0a5c1f98ee9","effective_user_id":"e2e_alice@test.local","event_id":"membership_conversation.member_joined_c_1f938251b203440fa463a0a5c1f98ee9_e2e_bob@test.local_1773009377_e2e_alice@test.local","event_ts":1773009377,"event_type":"conversation.member_joined","message_id":"membership_e2e_bob@test.local","payload":{"role":"member","status":"active","subject_user_id":"e2e_bob@test.local","timeline_state":{"conversation_created_at":1773009377,"participant_count":2},"transition":"conversation_created"},"payload_hash":"00208229b799b3b218cfc4fb02357f1c3e7ed9023be094a987b453a80ecfd2f4","prev_hash":"0000000000000000000000000000000000000000000000000000000000000000","schema_version":1,"tenant_id":"default"}