{"actor_user_id":"e2e_bob@test.local","conversation_id":"c_5dadb1a1a3af4daa80a9892ae340b0a2","effective_user_id":"e2e_bob@test.local","event_id":"msg_send_c_5dadb1a1a3af4daa80a9892ae340b0a2_m_0ad8d974b2e64de589be9f311bd47206_1772998308_e2e_bob@test.local","event_ts":1772998308,"event_type":"message.sent","message_id":"m_0ad8d974b2e64de589be9f311bd47206","payload":{"message":{"conversation_id":"c_5dadb1a1a3af4daa80a9892ae340b0a2","created_at":1772998308,"expired":false,"is_encrypted":false,"is_unlocked":true,"kind":"text","locked":false,"message_id":"m_0ad8d974b2e64de589be9f311bd47206","scheduled":false,"sender_id":"e2e_bob@test.local","text":"Compliance test DM message 1772998308302","view_once":false},"mutation":"send","scheduled":false},"payload_hash":"fa4fa4bb000bd7e928bbf9d24db8227cc5d898572d87426673ec8c76f51f4066","prev_hash":"0000000000000000000000000000000000000000000000000000000000000000","schema_version":1,"tenant_id":"default"}