{"actor_user_id":"e2e_charlie@test.local","conversation_id":"c_3897c013d9e844c8974f4c75297c5228","effective_user_id":"e2e_charlie@test.local","event_id":"msg_send_c_3897c013d9e844c8974f4c75297c5228_m_a5cfd66e48ae444890ab580203115d47_1773009559_e2e_charlie@test.local","event_ts":1773009559,"event_type":"message.sent","message_id":"m_a5cfd66e48ae444890ab580203115d47","payload":{"message":{"conversation_id":"c_3897c013d9e844c8974f4c75297c5228","created_at":1773009559,"expired":false,"is_encrypted":false,"is_unlocked":true,"kind":"text","locked":false,"message_id":"m_a5cfd66e48ae444890ab580203115d47","scheduled":false,"sender_id":"e2e_charlie@test.local","text":"Charlie group msg 1773009559426","view_once":false},"mutation":"send","scheduled":false},"payload_hash":"c0588d0ea8658f04032ef69ba282878194ce5945cd745df04cabb448e91fe1ec","prev_hash":"0000000000000000000000000000000000000000000000000000000000000000","schema_version":1,"tenant_id":"default"}