{"actor_user_id":"e2e_alice@test.local","conversation_id":"c_2d12060acc99445483095f379e5ca334","effective_user_id":"e2e_alice@test.local","event_id":"msg_delete_c_2d12060acc99445483095f379e5ca334_m_a30dedeaa7014e9f994ce5ed97e99b94_1773009454_e2e_alice@test.local","event_ts":1773009454,"event_type":"message.deleted","message_id":"m_a30dedeaa7014e9f994ce5ed97e99b94","payload":{"message":{"conversation_id":"c_2d12060acc99445483095f379e5ca334","created_at":1773009453,"deliver_at":1773013053,"expired":false,"is_encrypted":false,"is_unlocked":true,"kind":"text","locked":false,"message_id":"m_a30dedeaa7014e9f994ce5ed97e99b94","scheduled":true,"sender_id":"e2e_alice@test.local","text":"sched-api-1773009391855","view_once":false},"mutation":"delete","reason":"scheduled_cancelled"},"payload_hash":"add9b03382b30afe1bb1a4903f070b39fbe601e20a89a9484a59ca63f6d434da","prev_hash":"0000000000000000000000000000000000000000000000000000000000000000","schema_version":1,"tenant_id":"default"}