{"actor_user_id":"e2e_charlie@test.local","conversation_id":"c_1704fedc1e9b472eb09044bcbe0e027a","effective_user_id":"e2e_charlie@test.local","event_id":"membership_conversation.member_joined_c_1704fedc1e9b472eb09044bcbe0e027a_e2e_alice@test.local_1772999734_e2e_charlie@test.local","event_ts":1772999734,"event_type":"conversation.member_joined","message_id":"membership_e2e_alice@test.local","payload":{"role":"member","status":"pending","subject_user_id":"e2e_alice@test.local","timeline_state":{"conversation_created_at":1772999734,"participant_count":3},"transition":"conversation_created"},"payload_hash":"9edb1d1a8c840d89d39ef638e1540abb5b3a0e6c7fb917c7898f516c99002d5a","prev_hash":"0000000000000000000000000000000000000000000000000000000000000000","schema_version":1,"tenant_id":"default"}