{"actor_user_id":"e2e_alice@test.local","conversation_id":"c_871e8c68edd4432cb37858086e0657ad","effective_user_id":"e2e_alice@test.local","event_id":"msg_scheduled_delivery_c_871e8c68edd4432cb37858086e0657ad_m_9a4227f6188f440bafd1d72f842857e2_1773009029_e2e_alice@test.local","event_ts":1773009029,"event_type":"message.edited","message_id":"m_9a4227f6188f440bafd1d72f842857e2","payload":{"from_status":"scheduled","message":{"conversation_id":"c_871e8c68edd4432cb37858086e0657ad","created_at":1773009029,"expired":false,"expires_at":1773012604,"is_encrypted":false,"is_unlocked":true,"kind":"text","locked":false,"message_id":"m_9a4227f6188f440bafd1d72f842857e2","scheduled":false,"sender_id":"e2e_alice@test.local","text":"sched-expiry-1773008884591","view_once":false},"mutation":"scheduled_delivery_transition","to_status":"sent"},"payload_hash":"93fdee0c6cf897d8088ecbf0b99fe3e174fbb9c1e55df229b4f2112a18b2edde","prev_hash":"0000000000000000000000000000000000000000000000000000000000000000","schema_version":1,"tenant_id":"default"}