{"actor_user_id":"e2e_charlie@test.local","conversation_id":"c_e1210c33e70a47ac9738ba14ad99a791","effective_user_id":"e2e_charlie@test.local","event_id":"membership_conversation.member_joined_c_e1210c33e70a47ac9738ba14ad99a791_e2e_alice@test.local_1773009355_e2e_charlie@test.local","event_ts":1773009355,"event_type":"conversation.member_joined","message_id":"membership_e2e_alice@test.local","payload":{"role":"member","status":"pending","subject_user_id":"e2e_alice@test.local","timeline_state":{"conversation_created_at":1773009355,"participant_count":3},"transition":"conversation_created"},"payload_hash":"a1fe8efc7d66013870f68fb1d9c7f0473600589b18f9fe23b88327b460952884","prev_hash":"0000000000000000000000000000000000000000000000000000000000000000","schema_version":1,"tenant_id":"default"}